<?xml version="1.0"?>
<!DOCTYPE modulesynopsis SYSTEM "../style/modulesynopsis.dtd">
<?xml-stylesheet type="text/xsl" href="../style/manual.en.xsl"?>
<modulesynopsis metafile="mpm_winnt.xml.meta">

<name>mpm_winnt</name>
<description>This Multi-Processing Module is optimized for Windows
NT.</description>
<status>MPM</status>
<sourcefile>mpm_winnt.c</sourcefile>
<identifier>mpm_winnt_module</identifier>

<summary>
    <p>This Multi-Processing Module (MPM) is the default for the
    Windows NT operating systems. It uses a single control process
    which launches a single child process which in turn creates
    threads to handle requests</p>
</summary>

<directivesynopsis location="mpm_common"><name>CoreDumpDirectory</name>
</directivesynopsis>
<directivesynopsis location="mpm_common"><name>PidFile</name>
</directivesynopsis>
<directivesynopsis location="mpm_common"><name>Listen</name>
</directivesynopsis>
<directivesynopsis location="mpm_common"><name>ListenBacklog</name>
</directivesynopsis>
<directivesynopsis location="mpm_common"><name>MaxRequestsPerChild</name>
</directivesynopsis>
<directivesynopsis location="mpm_common"><name>ScoreBoardFile</name>
</directivesynopsis>
<directivesynopsis location="mpm_common"><name>SendBufferSize</name>
</directivesynopsis>
<directivesynopsis location="mpm_common"><name>ThreadLimit</name>
</directivesynopsis>
<directivesynopsis location="mpm_common"><name>ThreadsPerChild</name>
</directivesynopsis>

</modulesynopsis>
